{
  "activity_code": "HSP-C03-ACT-ROLEPLAY",
  "code": "HSP-C03-RP-FREE",
  "content_version": "0.3.0-draft",
  "entity_type": "prompt-item",
  "id": "47d86c10-52ed-57ad-a09f-c16550dd070b",
  "replaced_by": null,
  "replaces": null,
  "response_form": "role_play",
  "source_locator": {
    "artifact": "Hospitrainity.docx",
    "block_index": 318,
    "chapter": 3,
    "heading_path": [
      "Dealing with Customers on the Phone",
      "Step 6. Role-play"
    ],
    "normalized_text_sha256": "818593879dd423781c6a22083508b39594d273dae74244b68eca54472b1cbb6d"
  },
  "status": "published",
  "stem": "Prompt: A caller wants to book two nights next week. Answer the phone, take the booking, confirm the details, and close the call."
}
