{
  "activity_code": "HSP-C05-ACT-PRACTICE",
  "code": "HSP-C05-PR-I3",
  "content_version": "0.3.0-draft",
  "entity_type": "prompt-item",
  "id": "524aac52-346b-58d3-91d5-4dc979dac3cc",
  "replaced_by": null,
  "replaces": null,
  "response_form": "ordering",
  "source_locator": {
    "artifact": "Hospitrainity.docx",
    "block_index": 585,
    "chapter": 5,
    "heading_path": [
      "Customer Care Through Writing",
      "Step 5. Practice"
    ],
    "normalized_text_sha256": "9851fd3d98714c7e3b45322cfa6531165c66b979594e37582abb1112eb800875"
  },
  "status": "published",
  "stem": "3. Put the email parts in order: sign-off, greeting, body with the information, opening thank-you."
}
