{
  "activity_code": "HSP-C04-ACT-PRACTICE",
  "code": "HSP-C04-PR-I2",
  "content_version": "0.3.0-draft",
  "entity_type": "prompt-item",
  "id": "abb2db2e-5226-5e37-9144-2b1363ef4723",
  "replaced_by": null,
  "replaces": null,
  "response_form": "selection",
  "source_locator": {
    "artifact": "Hospitrainity.docx",
    "block_index": 434,
    "chapter": 4,
    "heading_path": [
      "The Guest-Services Hotline",
      "Step 5. Practice"
    ],
    "normalized_text_sha256": "f1efef18f2cee42ef87962cc4000cda258a7c7154ee65a199e3b723c837c489e"
  },
  "status": "published",
  "stem": "2. Choose the customer-centered reply when you are busy: (a) “We are busy, call later.” or (b) “Thank you for waiting. How may I help you?”"
}
