{
  "activity_code": "HSP-C07-ACT-ROLEPLAY",
  "code": "HSP-C07-RP-FREE",
  "content_version": "0.3.0-draft",
  "entity_type": "prompt-item",
  "id": "0867d561-23d9-5a65-a6fd-b7f188f3ca7a",
  "replaced_by": null,
  "replaces": null,
  "response_form": "role_play",
  "source_locator": {
    "artifact": "Hospitrainity.docx",
    "block_index": 895,
    "chapter": 7,
    "heading_path": [
      "Dealing with Problems and Complaints",
      "Step 6. Role-play"
    ],
    "normalized_text_sha256": "3576356757a4010a6cc671137d2a2d591575aef4f54d6d2df89c5867dc77016b"
  },
  "status": "published",
  "stem": "Prompt: A guest complains that the Wi-Fi has not worked all day. Handle it using the L-A-A-F framework."
}
