{
  "activity_code": "HSP-C06-ACT-ROLEPLAY",
  "code": "HSP-C06-RP-G2",
  "content_version": "0.3.0-draft",
  "entity_type": "prompt-item",
  "id": "5762b88d-35dc-5ffa-b952-62ad3d50e222",
  "replaced_by": null,
  "replaces": null,
  "response_form": "selection",
  "source_locator": {
    "artifact": "Hospitrainity.docx",
    "block_index": 739,
    "chapter": 6,
    "heading_path": [
      "Online and Social Media Customer Service",
      "Step 6. Role-play"
    ],
    "normalized_text_sha256": "5ecb356f756aa73ef191951de650386c3b085af512c1cfd5a9496828cbc294b1"
  },
  "status": "published",
  "stem": "Public comment: “Worst hotel ever, my room was dirty.”"
}
