{
  "activity_code": "HSP-C06-ACT-CONFIDENCE",
  "code": "HSP-C06-CC-SELF",
  "content_version": "0.3.0-draft",
  "entity_type": "prompt-item",
  "id": "6035ee36-d55c-562b-a7d7-79e16c809991",
  "replaced_by": null,
  "replaces": null,
  "response_form": "self_rating",
  "source_locator": {
    "artifact": "Hospitrainity.docx",
    "block_index": 780,
    "chapter": 6,
    "heading_path": [
      "Online and Social Media Customer Service",
      "Step 8. Confidence check"
    ],
    "normalized_text_sha256": "8ae726d271eb7a0bf90a65a1207e47b0e727c521ff95159d8c7f245ec46d05b7"
  },
  "status": "published",
  "stem": "Rate yourself honestly, from 1 (not confident yet) to 5 (very confident). This is just for you, and it is a good way to see your progress."
}
